{
  "$schema": "http://json-schema.org/draft-07/schema#",
  "title": "Perfil de Usuário Sintético",
  "description": "Um perfil sintético de usuário, combinando atributos explícitos (derivados) e enriquecimentos inferidos por IA.",
  "type": "object",
  "properties": {
    "id_usuario": {
      "type": "string",
      "format": "uuid",
      "description": "Identificador único para este usuário sintético."
    },
    "segmento": {
      "type": "object",
      "description": "Segmento financeiro ao qual este usuário pertence.",
      "properties": {
        "valor": {
          "type": "string",
          "enum": [
            "Planejadores",
            "Poupadores",
            "Materialistas",
            "Batalhadores",
            "Céticos",
            "Endividados"
          ]
        }
      },
      "required": ["valor"],
      "additionalProperties": false
    },
    "filosofia": {
      "type": "object",
      "description": "Filosofia principal do usuário sobre dinheiro.",
      "properties": {
        "valor": {
          "type": "string",
          "enum": ["Multiplicar", "Guardar", "Gastar", "Ganhar", "Evitar", "Pagar"]
        }
      },
      "required": ["valor"],
      "additionalProperties": false
    },
    "renda_mensal": {
      "type": "object",
      "description": "Renda mensal do usuário em R$.",
      "properties": {
        "valor": {
          "type": "number",
          "minimum": 0
        }
      },
      "required": ["valor"],
      "additionalProperties": false
    },
    "escolaridade": {
      "type": "object",
      "description": "Maior nível de escolaridade do usuário.",
      "properties": {
        "valor": {
          "type": "string",
          "enum": ["Ensino Fundamental", "Ensino Médio", "Superior Completo"]
        }
      },
      "required": ["valor"],
      "additionalProperties": false
    },
    "ocupacao": {
      "type": "object",
      "description": "Ocupação ou tipo de emprego do usuário.",
      "properties": {
        "valor": {
          "type": "string"
        }
      },
      "required": ["valor"],
      "additionalProperties": false
    },
    "usa_banco_tradicional": {
      "type": "object",
      "description": "Se o usuário utiliza banco tradicional (agência física).",
      "properties": {
        "valor": {
          "type": "boolean"
        }
      },
      "required": ["valor"],
      "additionalProperties": false
    },
    "usa_banco_digital": {
      "type": "object",
      "description": "Se o usuário utiliza banco digital (apenas online).",
      "properties": {
        "valor": {
          "type": "boolean"
        }
      },
      "required": ["valor"],
      "additionalProperties": false
    },
    "usa_corretora": {
      "type": "object",
      "description": "Se o usuário utiliza corretora de investimentos ou plataforma.",
      "properties": {
        "valor": {
          "type": "boolean"
        }
      },
      "required": ["valor"],
      "additionalProperties": false
    },
    "frequencia_poupanca_mensal": {
      "type": "object",
      "description": "Número de vezes por mês que o usuário poupa.",
      "properties": {
        "valor": {
          "type": "number",
          "minimum": 0
        }
      },
      "required": ["valor"],
      "additionalProperties": false
    },
    "comportamento_gastos": {
      "type": "object",
      "description": "Classificação do comportamento de gastos do usuário.",
      "properties": {
        "valor": {
          "type": "string",
          "enum": ["cauteloso", "consumo_imediato", "necessidades_basicas"]
        }
      },
      "required": ["valor"],
      "additionalProperties": false
    },
    "comportamento_investimentos": {
      "type": "object",
      "description": "Classificação do comportamento de investimentos do usuário.",
      "properties": {
        "valor": {
          "type": "string",
          "enum": ["diversificado", "basico", "nenhum"]
        }
      },
      "required": ["valor"],
      "additionalProperties": false
    },
    "score_risco_financeiro": {
      "type": "number",
      "description": "Score de risco financeiro inferido por IA (0.0 = baixo risco, 1.0 = alto risco), derivado de estabilidade de renda, dívidas, investimentos.",
      "minimum": 0.0,
      "maximum": 1.0,
      "example": 0.75
    },
    "engajamento_digital": {
      "type": "string",
      "description": "Nível de engajamento financeiro digital inferido por IA (baixo, médio, alto).",
      "enum": ["baixo", "medio", "alto"],
      "example": "alto"
    },
    "comportamento_poupanca": {
      "type": "string",
      "description": "Classificação inferida do comportamento de poupança pessoal (disciplinado, ocasional, ausente).",
      "enum": ["disciplinado", "ocasional", "ausente"],
      "example": "disciplinado"
    }
  },
  "required": [
    "id_usuario",
    "segmento",
    "filosofia",
    "renda_mensal",
    "escolaridade",
    "ocupacao",
    "usa_banco_tradicional",
    "usa_banco_digital",
    "usa_corretora",
    "frequencia_poupanca_mensal",
    "comportamento_gastos",
    "comportamento_investimentos"
  ],
  "additionalProperties": false
}
